<?xml version = "1.0" encoding = "UTF-8"?>
<xs:schema xmlns:xs = "http://www.w3.org/2001/XMLSchema"
			targetNamespace = "http://example.com/candies"
			xmlns = "http://example.com/candies"
		    elementFormDefault="qualified">
			<xs:element  name = "candies">
				<xs:complexType>
					<xs:sequence>
						<xs:element name = "candy"
								 type = "candy"
								 minOccurs = "3"
								 maxOccurs = "unbounded" />
					</xs:sequence>
				</xs:complexType>
			</xs:element>
			<xs:complexType name = "candy">
				<xs:sequence>
					<xs:element name = "name" type = "xs:string"/>
					<xs:element name = "energy" type = "xs:string" />
					<xs:element name = "type" type = "xs:string" />
					<xs:element name = "ingredients" type = "Ingredients"/>
					<xs:element name = "value" type = "Value"/>
					<xs:element name = "product_owner" type = "xs:string"/>
				</xs:sequence>
				<xs:attribute name = "productName" type = "xs:string" use = "required"/>
				<xs:attribute name = "filling" use = "optional" default = "no filling">
					<xs:simpleType>
						<xs:restriction base = "xs:string">
							<xs:enumeration value = "no filling"></xs:enumeration>
							<xs:enumeration value = "cacao"></xs:enumeration>
							<xs:enumeration value = "hazelnut"></xs:enumeration>
						</xs:restriction>
					</xs:simpleType>
				</xs:attribute>
			</xs:complexType>
				<xs:complexType name = "Ingredients">
					<xs:sequence>
						<xs:element name = "water" type = "xs:string"/>
						<xs:element name = "sugar" type = "xs:string"/>
						<xs:element name = "fructose" type = "xs:string"/>
						<xs:element name = "vaniline" type = "xs:string"/>
						<xs:element name = "chocolate_type" type = "xs:string"/>
					</xs:sequence>
				</xs:complexType>
				<xs:complexType name = "Value">
					<xs:sequence>
						<xs:element name = "proteins" type = "xs:string"/>
						<xs:element name = "fats" type = "xs:string"/>
						<xs:element name = "carbs" type = "xs:string"/>
					</xs:sequence>
				</xs:complexType>
				
	</xs:schema>
	